{
  "$schema": "http://json-schema.org/draft-07/schema#",
  "type": "object",
  "properties": {
    "count": { "type": "integer" },
    "next": { "type": ["string", "null"] },
    "previous": { "type": ["string", "null"] },
    "results": {
      "anyOf": [
        {
          "type": "object",
          "properties": {
            "total_sum": {
              "type": "object",
              "properties": {
                "spend": { "type": "number" },
                "settled": { "type": "number" },
                "pending": { "type": "number" },
                "refund": { "type": "number" },
                "reversed_amount": { "type": "number" },
                "fx_fee": { "type": "number" },
                "cross_border_fee": { "type": "number" },
                "decline_fee": { "type": "number" }
              },
              "additionalProperties": true
            },
            "data": {
              "type": "array",
              "items": {
                "type": "object",
                "properties": {
                  "id": { "type": "integer" },
                  "amount": { "type": ["number", "string"] },
                  "authorize_time": { "type": "string", "format": "date-time" },
                  "card": {
                    "type": "object",
                    "properties": {
                      "id": { "type": "integer" },
                      "name": { "type": ["string", "null"] },
                      "number": { "type": "string" },
                      "bin": { "type": ["string", "null"] },
                      "user": {
                        "type": "object",
                        "properties": {
                          "id": { "type": "integer" },
                          "email": { "type": "string", "format": "email" },
                          "person": {
                            "type": "object",
                            "properties": {
                              "first_name": { "type": "string" },
                              "last_name": { "type": "string" }
                            },
                            "additionalProperties": true
                          }
                        },
                        "additionalProperties": true
                      },
                      "payment_system": { "type": "string" }
                    },
                    "additionalProperties": true
                  },
                  "country": {
                    "type": "object",
                    "properties": {
                      "id": { "type": "integer" },
                      "name": { "type": "string" },
                      "code": { "type": "string" }
                    },
                    "additionalProperties": true
                  },
                  "cross_border_fee": { "type": "number" },
                  "currency": { "type": "string" },
                  "decline_fee": { "type": "number" },
                  "decline_reason": { "type": ["string", "null"] },
                  "description": { "type": "string" },
                  "direction": { "type": "string", "enum": ["in", "out"] },
                  "fx_fee": { "type": "number" },
                  "local_amount": { "type": "number" },
                  "mcc": { "type": "string" },
                  "merchant_info": { "type": "string" },
                  "merchant_image": { "type": "string" },
                  "merchant_name": { "type": "string" },
                  "refund_time": { "type": ["string", "null"], "format": "date-time" },
                  "reversed_time": { "type": ["string", "null"], "format": "date-time" },
                  "settled_time": { "type": ["string", "null"], "format": "date-time" },
                  "status": { "type": "string", "enum": ["pending", "settled", "refund", "declined", "reversed"] },
                  "total": { "type": "number" },
                  "processed_time": { "type": ["string", "null"], "format": "date-time" }
                },
                "additionalProperties": true
              }
            },
            "date_start": { "type": "string", "format": "date-time" },
            "date_end": { "type": "string", "format": "date-time" }
          },
          "additionalProperties": true
        },
        {
          "type": "array",
          "items": {
            "type": "object",
            "properties": {
              "id": { "type": "integer" },
              "name": { "type": "string" }
            },
            "required": ["id"],
            "additionalProperties": true
          }
        },
        {
          "type": "object",
          "properties": {
            "referral_code": { "type": "string" },
            "referral_program": {
              "type": "object",
              "properties": {
                "id": { "type": "integer" },
                "name": { "type": "string" },
                "description": { "type": "string" },
                "period": { "type": "integer" },
                "goal": { "type": "number" },
                "referrer_reward": { "type": "number" },
                "referee_reward": { "type": "number" }
              },
              "additionalProperties": true
            }
          },
          "additionalProperties": true
        }
      ]
    }
  },
  "additionalProperties": true
}
